{
  "schemaVersion": 1,
  "issue": "ISA-1653",
  "type": "feature",
  "summary": "Avisos de sesión Pro para LMU: fin previsto y carreras marcadas del calendario, con mini independiente.",
  "technicalNotes": [
    "Motor puro con reloj inyectado; mismos componentes del kit y registro de widgets.",
    "Ajustes de umbrales, duración, sonido y mini en Studio; toasts Windows reutilizan las preferencias generales.",
    "Contrato v11: el fin programado se muestra como previsto; fases, fin real y próxima sesión exigen señales actuales explícitas."
  ],
  "testing": [
    "Añadir Avisos de sesión en Studio; mover aviso y mini por separado, editar ajustes y deshacer.",
    "Comparar con ronda 4 v2 cuando esté disponible #1655; probar sonido y notificaciones en Windows."
  ],
  "knownLimitations": [
    "LMU no demuestra inicio/fin reales, formación/salida ni próxima sesión: sus avisos quedan ocultos.",
    "La distancia a salida/meta puede ser estimada, pero solo se pinta con una fase de salida validada; no es distancia a parrilla.",
    "El fin programado no acredita fin real ni inicio de carrera; al vencer el reloj previsto se oculta.",
    "Adaptar el productor de agenda a los recordatorios nuevos cuando se integre #1640.",
    "Sin nuevas capturas ni QA física de app; se conserva la referencia visual aprobada y la verificación por escenas/layout."
  ]
}
