{
  "schemaVersion": 1,
  "issue": "ISA-717",
  "type": "feature",
  "summary": "El Spotter usa una sola geometría y entrega sus avisos prioritarios mediante el radio bus.",
  "technicalNotes": [
    "Los siete avisos Spotter conservan sus textos en español, inglés, italiano y portugués brasileño.",
    "Coche a izquierda/derecha, tres en paralelo, sigue ahí y clears conservan contexto ligado al inicio real del audio.",
    "El evento visual mantiene engineer:notification, engineer:stream y SSE; el audio sigue siendo cache-only y cancelable.",
    "El flag -engineer-legacy-spotter restaura de forma exclusiva el camino anterior durante un ciclo de rollback."
  ],
  "testing": [
    "Provocar tráfico a izquierda, derecha y ambos lados; comprobar un único aviso audible y visual por transición.",
    "Confirmar que Spotter interrumpe un aviso no crítico y que un cambio de sesión no deja clears antiguos.",
    "Revisar /api/engineer/health: radioDelivery debe registrar samples y p95MS menor de 150 en la sesión real."
  ],
  "knownLimitations": [
    "El benchmark Go local no sustituye la sesión LMU/Wails real, que queda como gate humano de Isaac.",
    "Un clip no precacheado mantiene la salida visual pero no sintetiza audio durante la carrera."
  ]
}
