{
  "schemaVersion": 1,
  "issue": "ISA-1320",
  "type": "feature",
  "summary": "Relative Eficiencia incorpora movimientos suaves y una señal de color muy tenue al cruzarse coches, manteniendo estables al jugador y las cifras.",
  "technicalNotes": [
    "Deslizamientos de 220–300 ms sin rebote, fundidos de 120 ms y una señal de color de hasta el 4 % exclusivamente ante cruces reales.",
    "Reserva de huecos visuales alrededor del jugador; cifras nuevas no reinician animaciones ni añaden mediciones de layout o temporizadores.",
    "Continuidad de posición y opacidad durante entradas y salidas; limpieza al cambiar fuente, tamaño, presupuesto de movimiento o al desmontar.",
    "Seis escenas de revisión en Workshop sobre el renderer productivo compartido."
  ],
  "testing": [
    "Suite frontend completa en c809d5e8: 469 archivos, 3795 pruebas superadas y 2 omitidas.",
    "Revisión independiente con WAAPI activo: escala, retarget, primera transición, StrictMode, cambio de movimiento sin nuevo modelo y limpieza superados.",
    "Tras refinar la reentrada: pruebas focales de opacidad/limpieza, tipos, build, lint y ratchet sin nuevas incidencias; la suite completa antecede a este refinamiento.",
    "Escenas comprobadas con modelos visibles en práctica, clasificación y carrera."
  ],
  "knownLimitations": [
    "Pendiente valoración visual de Isaac y prueba física en Windows/OBS. Las pruebas DOM y los fixtures no sustituyen esa revisión.",
    "Entrega aislada para revisión; la composición local de Workshop con Delta/Standings no implica promoción de esas ramas."
  ]
}
